{
  "id": "clay-v0-embeddings",
  "title": "Clay Model v0 Embeddings",
  "version": "v0",
  "description": "Patch embeddings from the first Clay model (v0, ViT masked autoencoder) for selected regions, published by the Clay project on Source Cooperative in January 2024. Sparse coverage; superseded by the Clay v1.5 products.",
  "updated": "2026-10-28T00:00:00Z",
  "license": "ODC-By-1.0",
  "sci:doi": null,
  "provenance": {
    "source": "manual extraction",
    "source_id": null,
    "source_url": "https://source.coop/clay/clay-model-v0-embeddings",
    "references": [
      "https://docs.torchgeo.org/en/latest/api/datasets.html",
      "https://arxiv.org/abs/2601.13134"
    ],
    "retrieved": "2026-10-28T00:00:00Z",
    "review": [
      "Dims, resolution, years and dtype taken from TorchGeo's embedding table; the README does not state them."
    ]
  },
  "providers": [
    {
      "name": "Clay",
      "roles": [
        "producer",
        "licensor"
      ],
      "url": "https://madewithclay.org"
    },
    {
      "name": "Source Cooperative",
      "roles": [
        "host"
      ],
      "url": "https://source.coop"
    }
  ],
  "encoder_model": {
    "id": null,
    "name": "Clay",
    "checkpoint": "v0",
    "href": "https://huggingface.co/made-with-clay/Clay"
  },
  "emb:type": "chip",
  "emb:dimensions": [
    768
  ],
  "emb:chip_size": null,
  "emb:stride": null,
  "emb:grid_id": null,
  "emb:temporal_period": null,
  "data_type": "float32",
  "emb:original_data_type": null,
  "emb:quantization_method": null,
  "source_sensors": null,
  "processing:level": null,
  "processing:lineage": null,
  "spatial_resolution": "5.12km",
  "regions_coverage": [
    "Global (sparse)"
  ],
  "bbox": null,
  "start_datetime": "2018-01-01T00:00:00Z",
  "end_datetime": "2023-12-31T23:59:59Z",
  "temporal_coverage_note": "Sparse in space and time.",
  "num_embeddings": null,
  "assets": {
    "data": {
      "href": "https://source.coop/clay/clay-model-v0-embeddings",
      "title": "Source Cooperative",
      "type": "text/html",
      "roles": [
        "embeddings",
        "data"
      ]
    }
  },
  "hosting": [
    "Source Cooperative"
  ],
  "access_requirements": "open HTTP/S3, no account",
  "loaders": [
    "torchgeo.datasets.ClayEmbeddings"
  ],
  "benchmarks": null
}
